{
  "muse_perf_version": "0.1.0",
  "metadata": {
    "source": {
      "schema_id": "muse:work:01J9QR4T8V0W2X6Y8Z0A2C4E6G",
      "rendition_id": "r.synthwave"
    },
    "interpreter": {
      "model": "hand-built-fixture",
      "at": "2026-08-22T12:00:00Z"
    }
  },
  "tempo_map": [
    {
      "time": 0,
      "beat": 0,
      "bpm": 100
    },
    {
      "time": 2.7,
      "beat": 4.5,
      "bpm": 96
    }
  ],
  "parts": [
    {
      "id": "part.1",
      "name": "Lead",
      "instrument": {
        "name": "analog synth",
        "program": 81
      },
      "mix": {
        "gain": 0.8,
        "pan": -0.2,
        "reverb_send": 0.3
      }
    },
    {
      "id": "part.2",
      "name": "Bass",
      "instrument": {
        "name": "drum machine"
      }
    }
  ],
  "notes": [
    {
      "part": "part.1",
      "pitch": 74,
      "pitch_name": "D5",
      "onset": 0.0,
      "duration": 0.6,
      "onset_beat": 0,
      "duration_beats": 1,
      "velocity": 96,
      "articulation": "accent"
    },
    {
      "part": "part.1",
      "pitch": 77,
      "pitch_name": "F5",
      "onset": 0.6,
      "duration": 0.6,
      "onset_beat": 1,
      "duration_beats": 1,
      "velocity": 88
    },
    {
      "part": "part.2",
      "pitch": 36,
      "pitch_name": "C2",
      "onset": 0.0,
      "duration": 1.2,
      "onset_beat": 0,
      "duration_beats": 2,
      "velocity": 127,
      "controllers": {
        "pitch_bend": [0, 0.5, 0],
        "pressure": [0.4]
      }
    }
  ],
  "dynamics": [
    {
      "time": 0.0,
      "level": 0.7
    },
    {
      "time": 1.0,
      "part": "part.1",
      "level": 0.9
    }
  ]
}