{
  "muse_perf_version": "0.1.0",
  "metadata": {
    "source": { "schema_id": "muse:work:01J9QR4T8V0W2X6Y8Z0A2C4E6G", "rendition_id": "r.synthwave" },
    "interpreter": { "model": "hand-built-fixture", "at": "2026-08-22T00:00:00Z" }
  },
  "tempo_map": [
    { "time": 0.0, "beat": 0, "bpm": 96 },
    { "time": 2.5, "beat": 4, "bpm": 72 }
  ],
  "parts": [
    {
      "id": "p.lead",
      "name": "Lead",
      "instrument": { "name": "violin", "program": 40, "sample_set": "vsco2-ce" },
      "mix": { "gain": 0.8, "pan": 0.0, "reverb_send": 0.3 }
    },
    {
      "id": "p.bass",
      "name": "Bass",
      "instrument": { "name": "cello", "program": 43 }
    }
  ],
  "notes": [
    { "part": "p.lead", "pitch": 62, "pitch_name": "D4", "onset": 0.0, "duration": 0.3125, "onset_beat": 0, "duration_beats": 0.5, "velocity": 90, "articulation": "tenuto" },
    { "part": "p.lead", "pitch": 65, "pitch_name": "F4", "onset": 0.3125, "duration": 0.3125, "onset_beat": 0.5, "duration_beats": 0.5, "velocity": 88 },
    { "part": "p.lead", "pitch": 69, "pitch_name": "A4", "onset": 0.625, "duration": 0.625, "onset_beat": 1, "duration_beats": 1, "velocity": 96, "articulation": "accent", "controllers": { "pitch_bend": [0, 0.25, 0] } },
    { "part": "p.bass", "pitch": 38, "pitch_name": "D2", "onset": 0.0, "duration": 2.5, "onset_beat": 0, "duration_beats": 4, "velocity": 80 }
  ],
  "dynamics": [
    { "time": 0.0, "level": 0.5 },
    { "time": 1.25, "part": "p.lead", "level": 0.7 }
  ]
}
